[
  {
    "categoria": "financas-e-impostos",
    "total": 246,
    "ativos": 230,
    "digitais": 9,
    "percentDigital": 3.9
  },
  {
    "categoria": "educacao-e-pesquisa",
    "total": 244,
    "ativos": 166,
    "digitais": 55,
    "percentDigital": 33.1
  },
  {
    "categoria": "agropecuaria-e-vida-rural",
    "total": 176,
    "ativos": 157,
    "digitais": 9,
    "percentDigital": 5.7
  },
  {
    "categoria": "comunicacao-e-transparencia",
    "total": 142,
    "ativos": 133,
    "digitais": 123,
    "percentDigital": 92.5
  },
  {
    "categoria": "administracao-publica",
    "total": 132,
    "ativos": 96,
    "digitais": 67,
    "percentDigital": 69.8
  },
  {
    "categoria": "empresa-industria-e-comercio",
    "total": 122,
    "ativos": 111,
    "digitais": 14,
    "percentDigital": 12.6
  },
  {
    "categoria": "transito-e-transportes",
    "total": 98,
    "ativos": 71,
    "digitais": 34,
    "percentDigital": 47.9
  },
  {
    "categoria": "seguranca",
    "total": 67,
    "ativos": 36,
    "digitais": 6,
    "percentDigital": 16.7
  },
  {
    "categoria": "direitos-e-cidadania",
    "total": 61,
    "ativos": 37,
    "digitais": 11,
    "percentDigital": 29.7
  },
  {
    "categoria": "trabalho-emprego-e-previdencia",
    "total": 52,
    "ativos": 44,
    "digitais": 8,
    "percentDigital": 18.2
  },
  {
    "categoria": "meio-ambiente",
    "total": 41,
    "ativos": 33,
    "digitais": 5,
    "percentDigital": 15.2
  },
  {
    "categoria": "saude-e-cuidado",
    "total": 41,
    "ativos": 39,
    "digitais": 9,
    "percentDigital": 23.1
  },
  {
    "categoria": "ciencia-e-tecnologia",
    "total": 24,
    "ativos": 22,
    "digitais": 15,
    "percentDigital": 68.2
  },
  {
    "categoria": "esporte-e-lazer",
    "total": 19,
    "ativos": 8,
    "digitais": 2,
    "percentDigital": 25.0
  },
  {
    "categoria": "energia",
    "total": 15,
    "ativos": 14,
    "digitais": 3,
    "percentDigital": 21.4
  },
  {
    "categoria": "assistencia-social",
    "total": 13,
    "ativos": 10,
    "digitais": 3,
    "percentDigital": 30.0
  },
  {
    "categoria": "turismo",
    "total": 9,
    "ativos": 7,
    "digitais": 3,
    "percentDigital": 42.9
  },
  {
    "categoria": "infraestrutura",
    "total": 7,
    "ativos": 4,
    "digitais": 2,
    "percentDigital": 50.0
  },
  {
    "categoria": "arte-e-cultura",
    "total": 7,
    "ativos": 5,
    "digitais": 1,
    "percentDigital": 20.0
  },
  {
    "categoria": "habitacao",
    "total": 5,
    "ativos": 5,
    "digitais": 1,
    "percentDigital": 20.0
  },
  {
    "categoria": "justica",
    "total": 2,
    "ativos": 0,
    "digitais": 0,
    "percentDigital": 0
  },
  {
    "categoria": "forcas-armadas-e-defesa-civil",
    "total": 1,
    "ativos": 1,
    "digitais": 0,
    "percentDigital": 0.0
  }
]